<xs:schema attributeFormDefault="unqualified" elementFormDefault="qualified" xmlns:xs="http://www.w3.org/2001/XMLSchema">
	<xs:element name="list">
		<xs:complexType>
			<xs:sequence>
				<xs:element name="route" maxOccurs="unbounded" minOccurs="0">
					<xs:complexType>
						<xs:sequence>
							<xs:element name="point" maxOccurs="unbounded" minOccurs="0">
								<xs:complexType>
									<xs:simpleContent>
										<xs:extension base="xs:string">
											<xs:attribute type="xs:int" name="x" use="required"/>
											<xs:attribute type="xs:int" name="y" use="required"/>
											<xs:attribute type="xs:int" name="z" use="required"/>
											<xs:attribute type="xs:int" name="delay" use="required"/>
											<xs:attribute type="xs:string" name="run" use="required"/>
											<xs:attribute type="xs:string" name="chat" use="optional"/>
										</xs:extension>
									</xs:simpleContent>
								</xs:complexType>
							</xs:element>
						</xs:sequence>
						<xs:attribute type="xs:int" name="npcId" use="required"/>
					</xs:complexType>
				</xs:element>
			</xs:sequence>
		</xs:complexType>
	</xs:element>
</xs:schema>